irun(64): 15.20-s051: (c) Copyright 1995-2018 Cadence Design Systems, Inc.
TOOL:	irun(64)	15.20-s051: Started on Apr 10, 2019 at 10:28:35 IST
irun
	-access +rwc
	GHASH_TOP_DATAPATH.v
	GHASH_TOP_tb.v
DEFINE gpdk045		$ANALOG/45nm/gpdk045		
|
irun: *W,DLCPTH (/tools/cadence/FOUNDRY/cds.lib,15): cds.lib Permission denied '/tools/cadence/FOUNDRY/analog/45nm/gpdk045' (cds.lib command ignored).
DEFINE rfLib_new	/home/install/FOUNDRY/rfLib_new
|
irun: *W,DLCPTH (/tools/cadence/FOUNDRY/cds.lib,19): cds.lib Invalid path '/home/install/FOUNDRY/rfLib_new' (cds.lib command ignored).
DEFINE gpdk045		$ANALOG/45nm/gpdk045		
|
irun: *W,DLCPTH (/tools/cadence/FOUNDRY/cds.lib,15): cds.lib Permission denied '/tools/cadence/FOUNDRY/analog/45nm/gpdk045' (cds.lib command ignored).
DEFINE rfLib_new	/home/install/FOUNDRY/rfLib_new
|
irun: *W,DLCPTH (/tools/cadence/FOUNDRY/cds.lib,19): cds.lib Invalid path '/home/install/FOUNDRY/rfLib_new' (cds.lib command ignored).
DEFINE gpdk045		$ANALOG/45nm/gpdk045		
|
irun: *W,DLCPTH (/tools/cadence/FOUNDRY/cds.lib,15): cds.lib Permission denied '/tools/cadence/FOUNDRY/analog/45nm/gpdk045' (cds.lib command ignored).
DEFINE rfLib_new	/home/install/FOUNDRY/rfLib_new
|
irun: *W,DLCPTH (/tools/cadence/FOUNDRY/cds.lib,19): cds.lib Invalid path '/home/install/FOUNDRY/rfLib_new' (cds.lib command ignored).
DEFINE gpdk045		$ANALOG/45nm/gpdk045		
|
irun: *W,DLCPTH (/tools/cadence/FOUNDRY/cds.lib,15): cds.lib Permission denied '/tools/cadence/FOUNDRY/analog/45nm/gpdk045' (cds.lib command ignored).
DEFINE rfLib_new	/home/install/FOUNDRY/rfLib_new
|
irun: *W,DLCPTH (/tools/cadence/FOUNDRY/cds.lib,19): cds.lib Invalid path '/home/install/FOUNDRY/rfLib_new' (cds.lib command ignored).
Recompiling... reason: file './GHASH_TOP_tb.v' is newer than expected.
	expected: Wed Apr 10 10:23:41 2019
	actual:   Wed Apr 10 10:25:54 2019
DEFINE gpdk045		$ANALOG/45nm/gpdk045		
|
irun: *W,DLCPTH (/tools/cadence/FOUNDRY/cds.lib,15): cds.lib Permission denied '/tools/cadence/FOUNDRY/analog/45nm/gpdk045' (cds.lib command ignored).
DEFINE rfLib_new	/home/install/FOUNDRY/rfLib_new
|
irun: *W,DLCPTH (/tools/cadence/FOUNDRY/cds.lib,19): cds.lib Invalid path '/home/install/FOUNDRY/rfLib_new' (cds.lib command ignored).
DEFINE gpdk045		$ANALOG/45nm/gpdk045		
|
ncvlog: *W,DLCPTH (/tools/cadence/FOUNDRY/cds.lib,15): cds.lib Permission denied '/tools/cadence/FOUNDRY/analog/45nm/gpdk045' (cds.lib command ignored).
DEFINE rfLib_new	/home/install/FOUNDRY/rfLib_new
|
ncvlog: *W,DLCPTH (/tools/cadence/FOUNDRY/cds.lib,19): cds.lib Invalid path '/home/install/FOUNDRY/rfLib_new' (cds.lib command ignored).
file: GHASH_TOP_tb.v
	module worklib.tb:v
		errors: 0, warnings: 0
	Total errors/warnings found outside modules and primitives:
		errors: 0, warnings: 2
DEFINE gpdk045		$ANALOG/45nm/gpdk045		
|
irun: *W,DLCPTH (/tools/cadence/FOUNDRY/cds.lib,15): cds.lib Permission denied '/tools/cadence/FOUNDRY/analog/45nm/gpdk045' (cds.lib command ignored).
DEFINE rfLib_new	/home/install/FOUNDRY/rfLib_new
|
irun: *W,DLCPTH (/tools/cadence/FOUNDRY/cds.lib,19): cds.lib Invalid path '/home/install/FOUNDRY/rfLib_new' (cds.lib command ignored).
DEFINE gpdk045		$ANALOG/45nm/gpdk045		
|
irun: *W,DLCPTH (/tools/cadence/FOUNDRY/cds.lib,15): cds.lib Permission denied '/tools/cadence/FOUNDRY/analog/45nm/gpdk045' (cds.lib command ignored).
DEFINE rfLib_new	/home/install/FOUNDRY/rfLib_new
|
irun: *W,DLCPTH (/tools/cadence/FOUNDRY/cds.lib,19): cds.lib Invalid path '/home/install/FOUNDRY/rfLib_new' (cds.lib command ignored).
DEFINE gpdk045		$ANALOG/45nm/gpdk045		
|
ncelab: *W,DLCPTH (/tools/cadence/FOUNDRY/cds.lib,15): cds.lib Permission denied '/tools/cadence/FOUNDRY/analog/45nm/gpdk045' (cds.lib command ignored).
DEFINE rfLib_new	/home/install/FOUNDRY/rfLib_new
|
ncelab: *W,DLCPTH (/tools/cadence/FOUNDRY/cds.lib,19): cds.lib Invalid path '/home/install/FOUNDRY/rfLib_new' (cds.lib command ignored).
		Caching library 'worklib' ....... Done
	Elaborating the design hierarchy:
		Caching library 'worklib' ....... Done
	Top level design units:
		tb
        .mux_sel(mul_sel),
                       |
ncelab: *W,CUVMPW (./GHASH_TOP_DATAPATH.v,21|23): port sizes differ in port connection (1/2).
              .b(s_reg_data_out_w),
                                |
ncelab: *W,CUVMPW (./GHASH_TOP_DATAPATH.v,25|32): port sizes differ in port connection (1/128).
              .s_out(s_reg_data_out_w));
                                    |
ncelab: *W,CUVMPW (./GHASH_TOP_DATAPATH.v,50|36): port sizes differ in port connection (1/128).
	Building instance overlay tables: .................... Done
	Generating native compiled code:
DEFINE gpdk045		$ANALOG/45nm/gpdk045		
|
ncvlog_cg: *W,DLCPTH (/tools/cadence/FOUNDRY/cds.lib,15): cds.lib Permission denied '/tools/cadence/FOUNDRY/analog/45nm/gpdk045' (cds.lib command ignored).
DEFINE rfLib_new	/home/install/FOUNDRY/rfLib_new
|
ncvlog_cg: *W,DLCPTH (/tools/cadence/FOUNDRY/cds.lib,19): cds.lib Invalid path '/home/install/FOUNDRY/rfLib_new' (cds.lib command ignored).
		worklib.tb:v <0x05d84761>
			streams:  14, words:  8187
	Building instance specific data structures.
        .mux_sel(mul_sel),
                       |
ncelab: *W,CSINFI (./GHASH_TOP_DATAPATH.v,21|23): implicit wire has no fanin (tb.dut.mul_sel).
	Loading native compiled code:     .................... Done
	Design hierarchy summary:
		               Instances  Unique
		Modules:              10      10
		Registers:            22      22
		Scalar wires:        136       -
		Expanded wires:      128       1
		Vectored wires:       12       -
		Always blocks:         7       7
		Initial blocks:        2       2
		Cont. assignments:     1       3
		Pseudo assignments:   11      11
	Writing initial simulation snapshot: worklib.tb:v
DEFINE gpdk045		$ANALOG/45nm/gpdk045		
|
ncsim: *W,DLCPTH (/tools/cadence/FOUNDRY/cds.lib,15): cds.lib Permission denied '/tools/cadence/FOUNDRY/analog/45nm/gpdk045' (cds.lib command ignored).
DEFINE rfLib_new	/home/install/FOUNDRY/rfLib_new
|
ncsim: *W,DLCPTH (/tools/cadence/FOUNDRY/cds.lib,19): cds.lib Invalid path '/home/install/FOUNDRY/rfLib_new' (cds.lib command ignored).
Loading snapshot worklib.tb:v .................... Done
ncsim> source /tools/cadence/INCISIVE152/tools/inca/files/ncsimrc
ncsim> run
====================================
        GHASH TOP DATAPATH TB       
====================================
Simulation complete via $finish(1) at time 80 NS + 0
./GHASH_TOP_tb.v:76 $finish();
ncsim> exit
TOOL:	irun(64)	15.20-s051: Exiting on Apr 10, 2019 at 10:28:36 IST  (total: 00:00:01)
